Name;Description;Group_of_People;Name_length;Description_length;desc_w/o_stopwords;name_w/o_stopwords;desc_plain;desc_token;desc_types;desc_TTR
List of Gran Torino characters;"The following is a list of significant characters who feature in the 2008 film Gran Torino, directed by Clint Eastwood.
Casting calls were held in Fresno, California, Detroit, Michigan, and Saint Paul, Minnesota, from which Eastwood selected ten Hmong American lead actors and supporting actors. Of them, only one was not a first time actor. Of the Hmong cast, five, including Bee Vang, one of the principal actors, were from the state of Minnesota. Ahney Her comes from Lansing, Michigan. The casting agency Pound & Mooney recruited thirty actors and over 500 extras. The firm recruited many Hmong actors from a Hmong soccer tournament in Macomb County, Michigan. Sandy Ci Moua, a Hmong actress based in the Minneapolis-St. Paul area, assisted with the film's casting of Hmong actors.One actor who auditioned praised how the casting avoided the typical Asian stereotypes in favor of authenticity, saying ""They could have walked down Hollywood and looked for some Korean, Chinese, whatever, Asian-American actors, and say, 'Hey, can we teach you a few Hmong (words),' like they do in other movies, just mimic the words. But no, they said, 'We want real Hmong-speaking actors.' Asian Americans, we can tell, 'That guy's not Chinese! That guy's not Korean!' So, stop trying to fool us.""";Film People;30;1284;"The following list significant characters feature 2008 film Gran Torino, directed Clint Eastwood. Casting calls held Fresno, California, Detroit, Michigan, Saint Paul, Minnesota, Eastwood selected ten Hmong American lead actors supporting actors. Of them, one first time actor. Of Hmong cast, five, including Bee Vang, one principal actors, state Minnesota. Ahney Her comes Lansing, Michigan. The casting agency Pound & Mooney recruited thirty actors 500 extras. The firm recruited many Hmong actors Hmong soccer tournament Macomb County, Michigan. Sandy Ci Moua, Hmong actress based Minneapolis-St. Paul area, assisted film's casting Hmong actors.One actor auditioned praised casting avoided typical Asian stereotypes favor authenticity, saying ""They could walked Hollywood looked Korean, Chinese, whatever, Asian-American actors, say, 'Hey, teach Hmong (words),' like movies, mimic words. But no, said, 'We want real Hmong-speaking actors.' Asian Americans, tell, 'That guy's Chinese! That guy's Korean!' So, stop trying fool us.""";List Gran Torino characters;"the following is a list of significant characters who feature in the 2008 film gran torino directed by clint eastwood 
casting calls were held in fresno california detroit michigan and saint paul minnesota from which eastwood selected ten hmong american lead actors and supporting actors of them only one was not a first time actor of the hmong cast five including bee vang one of the principal actors were from the state of minnesota ahney her comes from lansing michigan the casting agency pound  mooney recruited thirty actors and over 500 extras the firm recruited many hmong actors from a hmong soccer tournament in macomb county michigan sandy ci moua a hmong actress based in the minneapolis-st paul area assisted with the film s casting of hmong actors one actor who auditioned praised how the casting avoided the typical asian stereotypes in favor of authenticity saying ""they could have walked down hollywood and looked for some korean chinese whatever asian-american actors and say  hey can we teach you a few hmong words  like they do in other movies just mimic the words but no they said  we want real hmong-speaking actors  asian americans we can tell  that guy s not chinese that guy s not korean  so stop trying to fool us """;213;138;64.7887323943662
List of Highlander characters;This is a list of characters from the Highlander franchise.;Film People;29;59;This list characters Highlander franchise.;List Highlander characters;this is a list of characters from the highlander franchise ;10;10;100.0
List of Alfred Hitchcock cameo appearances;"English film director Alfred Hitchcock made cameo appearances in 40 of his 54 surviving major films (his second film, The Mountain Eagle, is lost). For the films in which he appeared, he would be seen for a brief moment in a non-speaking part as an extra, such as boarding a bus, crossing in front of a building, standing in an apartment across the courtyard, or even appearing in a newspaper photograph (as seen in the film Lifeboat, which otherwise provided no other opportunity for him to appear).
During the filming of The Lodger, Hitchcock later said his cameo came about at the last minute because the actor who was supposed to play the bit part of a telephone operator failed to show up, so Hitchcock filled in for him. This playful gesture became one of Hitchcock's trademark signatures; and fans would make a sport of trying to spot his cameos. As a recurring theme, he would carry a musical instrument – especially memorable was the double bass case that he wrestles onto the train at the beginning of Strangers on a Train. In his earliest appearances, he filled in as an obscure extra in crowds or walking through scenes in long camera shots. His later appearances became more prominent, such as when he turns to see Jane Wyman's disguise as she passes him in Stage Fright, and in stark silhouette in his final film Family Plot.
His appearances became so popular that he began to make them earlier in his films so as not to distract the audience from the plot. Hitchcock confirms this in extended interviews with François Truffaut, and indeed the majority of his appearances occur within the first half-hour of his films, with over half in the first 15 minutes. 
Hitchcock's longest cameo appearances are in his British films Blackmail and Young and Innocent. He appears in all 30 features from Rebecca (his first American film) onward; before his move to Hollywood, he only occasionally performed cameos.";Film People;42;1916;"English film director Alfred Hitchcock made cameo appearances 40 54 surviving major films (his second film, The Mountain Eagle, lost). For films appeared, would seen brief moment non-speaking part extra, boarding bus, crossing front building, standing apartment across courtyard, even appearing newspaper photograph (as seen film Lifeboat, otherwise provided opportunity appear). During filming The Lodger, Hitchcock later said cameo came last minute actor supposed play bit part telephone operator failed show up, Hitchcock filled him. This playful gesture became one Hitchcock's trademark signatures; fans would make sport trying spot cameos. As recurring theme, would carry musical instrument – especially memorable double bass case wrestles onto train beginning Strangers Train. In earliest appearances, filled obscure extra crowds walking scenes long camera shots. His later appearances became prominent, turns see Jane Wyman's disguise passes Stage Fright, stark silhouette final film Family Plot. His appearances became popular began make earlier films distract audience plot. Hitchcock confirms extended interviews François Truffaut, indeed majority appearances occur within first half-hour films, half first 15 minutes. Hitchcock's longest cameo appearances British films Blackmail Young Innocent. He appears 30 features Rebecca (his first American film) onward; move Hollywood, occasionally performed cameos.";List Alfred Hitchcock cameo appearances;"english film director alfred hitchcock made cameo appearances in 40 of his 54 surviving major films his second film the mountain eagle is lost  for the films in which he appeared he would be seen for a brief moment in a non-speaking part as an extra such as boarding a bus crossing in front of a building standing in an apartment across the courtyard or even appearing in a newspaper photograph as seen in the film lifeboat which otherwise provided no other opportunity for him to appear 
during the filming of the lodger hitchcock later said his cameo came about at the last minute because the actor who was supposed to play the bit part of a telephone operator failed to show up so hitchcock filled in for him this playful gesture became one of hitchcock s trademark signatures and fans would make a sport of trying to spot his cameos as a recurring theme he would carry a musical instrument – especially memorable was the double bass case that he wrestles onto the train at the beginning of strangers on a train in his earliest appearances he filled in as an obscure extra in crowds or walking through scenes in long camera shots his later appearances became more prominent such as when he turns to see jane wyman s disguise as she passes him in stage fright and in stark silhouette in his final film family plot 
his appearances became so popular that he began to make them earlier in his films so as not to distract the audience from the plot hitchcock confirms this in extended interviews with françois truffaut and indeed the majority of his appearances occur within the first half-hour of his films with over half in the first 15 minutes 
hitchcock s longest cameo appearances are in his british films blackmail and young and innocent he appears in all 30 features from rebecca his first american film onward before his move to hollywood he only occasionally performed cameos ";333;187;56.15615615615616
List of original characters in The Hobbit film series;This is a list of original characters found in Peter Jackson's series of film adaptations of J. R. R. Tolkien's 1937 novel The Hobbit.;Film People;53;134;This list original characters found Peter Jackson's series film adaptations J. R. R. Tolkien's 1937 novel The Hobbit.;List original characters The Hobbit film series;this is a list of original characters found in peter jackson s series of film adaptations of j r r tolkien s 1937 novel the hobbit ;26;22;84.61538461538461
List of The Hunger Games characters;The following is a list of characters in The Hunger Games novels, a series of young adult science fiction novels by Suzanne Collins whose original trilogy was later adapted into a series of four feature films. The actors who portray these characters are given in List of The Hunger Games cast members.;Film People;35;301;The following list characters The Hunger Games novels, series young adult science fiction novels Suzanne Collins whose original trilogy later adapted series four feature films. The actors portray characters given List The Hunger Games cast members.;List The Hunger Games characters;the following is a list of characters in the hunger games novels a series of young adult science fiction novels by suzanne collins whose original trilogy was later adapted into a series of four feature films the actors who portray these characters are given in list of the hunger games cast members ;52;37;71.15384615384616
List of Indiana Jones characters;This is a list of characters in the Indiana Jones series.;Film People;32;57;This list characters Indiana Jones series.;List Indiana Jones characters;this is a list of characters in the indiana jones series ;11;11;100.0
List of The Jungle Book characters;This is a list of characters that appear in Rudyard Kipling's 1894 The Jungle Book story collection, its 1895 sequel The Second Jungle Book, and the various film adaptations based on those books. Characters include both human and talking animal characters.;Film People;34;256;This list characters appear Rudyard Kipling's 1894 The Jungle Book story collection, 1895 sequel The Second Jungle Book, various film adaptations based books. Characters include human talking animal characters.;List The Jungle Book characters;this is a list of characters that appear in rudyard kipling s 1894 the jungle book story collection its 1895 sequel the second jungle book and the various film adaptations based on those books characters include both human and talking animal characters ;42;35;83.33333333333334
List of Jurassic Park characters;"The following is a list of fictional characters from Michael Crichton's 1990 novel Jurassic Park, its 1995 sequel The Lost World, and their film adaptations, Jurassic Park (1993) and The Lost World: Jurassic Park (1997). Also included are characters from the sequel films Jurassic Park III, Jurassic World, Jurassic World: Fallen Kingdom, Jurassic World Dominion, and the short film Battle at Big Rock. These films are not adaptations and have no original source novels but contain some characters and events based on the fictional universe of Crichton's novels. Some cast members from the films have also reprised their roles in certain video games.
The original novel introduces several characters who would appear throughout the film series, including Dr. Alan Grant, Dr. Ellie Sattler, Dr. Ian Malcolm, John Hammond, and Dr. Henry Wu. Jurassic World introduces Owen Grady and Claire Dearing, who are the lead characters of the Jurassic World trilogy.";Film People;32;954;The following list fictional characters Michael Crichton's 1990 novel Jurassic Park, 1995 sequel The Lost World, film adaptations, Jurassic Park (1993) The Lost World: Jurassic Park (1997). Also included characters sequel films Jurassic Park III, Jurassic World, Jurassic World: Fallen Kingdom, Jurassic World Dominion, short film Battle Big Rock. These films adaptations original source novels contain characters events based fictional universe Crichton's novels. Some cast members films also reprised roles certain video games. The original novel introduces several characters would appear throughout film series, including Dr. Alan Grant, Dr. Ellie Sattler, Dr. Ian Malcolm, John Hammond, Dr. Henry Wu. Jurassic World introduces Owen Grady Claire Dearing, lead characters Jurassic World trilogy.;List Jurassic Park characters;"the following is a list of fictional characters from michael crichton s 1990 novel jurassic park its 1995 sequel the lost world and their film adaptations jurassic park 1993 and the lost world jurassic park 1997  also included are characters from the sequel films jurassic park iii jurassic world jurassic world fallen kingdom jurassic world dominion and the short film battle at big rock these films are not adaptations and have no original source novels but contain some characters and events based on the fictional universe of crichton s novels some cast members from the films have also reprised their roles in certain video games 
the original novel introduces several characters who would appear throughout the film series including dr alan grant dr ellie sattler dr ian malcolm john hammond and dr henry wu jurassic world introduces owen grady and claire dearing who are the lead characters of the jurassic world trilogy ";152;87;57.23684210526315
List of The Karate Kid and Cobra Kai characters;"This list of The Karate Kid and Cobra Kai characters reflects fictional characters from The Karate Kid franchise. Josh Heald, Jon Hurwitz, and Hayden Schlossberg define the following works as part of the Miyagi-Verse: The Karate Kid (1984), The Karate Kid Part II (1986), The Karate Kid Part III (1989), The Next Karate Kid (1994), and the Cobra Kai television series (2018–present). However, they state that the 2010 remake exists in an alternate universe. In addition, Jon Hurwitz clarified that the ""Karate Kid cartoon is not canon. But there is an Easter Egg from it in Season 3,"" in response to the question as to whether, ""The Karate Kid animated series  [is]  official within The Karate Kid universe?""";Film People;47;708;"This list The Karate Kid Cobra Kai characters reflects fictional characters The Karate Kid franchise. Josh Heald, Jon Hurwitz, Hayden Schlossberg define following works part Miyagi-Verse: The Karate Kid (1984), The Karate Kid Part II (1986), The Karate Kid Part III (1989), The Next Karate Kid (1994), Cobra Kai television series (2018–present). However, state 2010 remake exists alternate universe. In addition, Jon Hurwitz clarified ""Karate Kid cartoon canon. But Easter Egg Season 3,"" response question whether, ""The Karate Kid animated series [is] official within The Karate Kid universe?""";List The Karate Kid Cobra Kai characters;"this list of the karate kid and cobra kai characters reflects fictional characters from the karate kid franchise josh heald jon hurwitz and hayden schlossberg define the following works as part of the miyagi-verse the karate kid 1984  the karate kid part ii 1986  the karate kid part iii 1989  the next karate kid 1994  and the cobra kai television series 2018–present  however they state that the 2010 remake exists in an alternate universe in addition jon hurwitz clarified that the ""karate kid cartoon is not canon but there is an easter egg from it in season 3 "" in response to the question as to whether ""the karate kid animated series [is] official within the karate kid universe """;120;71;59.166666666666664
List of Kingsman characters;Kingsman is a British-American spy action-comedy film series co-produced and directed by Matthew Vaughn and distributed by 20th Century Fox, based on the Icon Comics graphic novel by Mark Millar and Dave Gibbons. Consisting of two films, the following is a list of characters from Kingsman.;Film People;27;290;Kingsman British-American spy action-comedy film series co-produced directed Matthew Vaughn distributed 20th Century Fox, based Icon Comics graphic novel Mark Millar Dave Gibbons. Consisting two films, following list characters Kingsman.;List Kingsman characters;kingsman is a british-american spy action-comedy film series co-produced and directed by matthew vaughn and distributed by 20th century fox based on the icon comics graphic novel by mark millar and dave gibbons consisting of two films the following is a list of characters from kingsman ;46;37;80.43478260869566
List of feature films with LGBT characters;"The following is a list of feature films with fictional and factual lesbian, gay, bisexual, or transgender characters. The films were released theatrically, direct-to-video, or on a streaming platform (non-television network).
For queer characters  (""Q"" in LGBTQ), see lists for asexual, intersex, non-binary, and pansexual characters.";Film People;42;335;"The following list feature films fictional factual lesbian, gay, bisexual, transgender characters. The films released theatrically, direct-to-video, streaming platform (non-television network). For queer characters (""Q"" LGBTQ), see lists asexual, intersex, non-binary, pansexual characters.";List feature films LGBT characters;"the following is a list of feature films with fictional and factual lesbian gay bisexual or transgender characters the films were released theatrically direct-to-video or on a streaming platform non-television network 
for queer characters  ""q"" in lgbtq  see lists for asexual intersex non-binary and pansexual characters ";46;38;82.6086956521739
List of The Librarian characters;This is a list of characters in The Librarian series. They are all characters who have appeared either in the Librarian television films, or the Librarians series.;Film People;32;163;This list characters The Librarian series. They characters appeared either Librarian television films, Librarians series.;List The Librarian characters;this is a list of characters in the librarian series they are all characters who have appeared either in the librarian television films or the librarians series ;27;21;77.77777777777779
List of fictional couriers in film and television;This is a list of fictional couriers in film and television that have been identified by name in notable works. A courier is usually someone who delivers something such as a message, package, or letter from one person to another. Couriers can be employees working exclusively for one person or can be freelance who are hired for one job. Couriers are different than mail service as they are a single person working exclusively for their client at one time.;Film People;49;456;This list fictional couriers film television identified name notable works. A courier usually someone delivers something message, package, letter one person another. Couriers employees working exclusively one person freelance hired one job. Couriers different mail service single person working exclusively client one time.;List fictional couriers film television;this is a list of fictional couriers in film and television that have been identified by name in notable works a courier is usually someone who delivers something such as a message package or letter from one person to another couriers can be employees working exclusively for one person or can be freelance who are hired for one job couriers are different than mail service as they are a single person working exclusively for their client at one time ;79;56;70.88607594936708
List of original characters in The Lord of the Rings film series;This is a list of original characters in The Lord of the Rings film series, Peter Jackson's 2001-2003 film adaptation of J. R. R. Tolkien's 1954-1955 book.;Film People;64;155;This list original characters The Lord Rings film series, Peter Jackson's 2001-2003 film adaptation J. R. R. Tolkien's 1954-1955 book.;List original characters The Lord Rings film series;this is a list of original characters in the lord of the rings film series peter jackson s 2001-2003 film adaptation of j r r tolkien s 1954-1955 book ;29;23;79.3103448275862
List of Lorien Legacies characters;This is a list of characters appearing in the Lorien Legacies series of young adult science fiction books, written under the pseudonym Pittacus Lore.;Film People;34;149;This list characters appearing Lorien Legacies series young adult science fiction books, written pseudonym Pittacus Lore.;List Lorien Legacies characters;this is a list of characters appearing in the lorien legacies series of young adult science fiction books written under the pseudonym pittacus lore ;24;22;91.66666666666666
Characters of the Marvel Cinematic Universe;"The Marvel Cinematic Universe (MCU) is an American media franchise and shared universe that involves productions of superhero films and television series. These productions star various titular superheroes; they are independently produced by Marvel Studios and are based on characters that appear in American comic books published by Marvel Comics. The shared universe, much like the original Marvel Universe in comic books, was established by crossing over common plots, settings, casts, and characters.";Film People;43;504;"The Marvel Cinematic Universe (MCU) American media franchise shared universe involves productions superhero films television series. These productions star various titular superheroes; independently produced Marvel Studios based characters appear American comic books published Marvel Comics. The shared universe, much like original Marvel Universe comic books, established crossing common plots, settings, casts, characters.";Characters Marvel Cinematic Universe;the marvel cinematic universe mcu is an american media franchise and shared universe that involves productions of superhero films and television series these productions star various titular superheroes they are independently produced by marvel studios and are based on characters that appear in american comic books published by marvel comics the shared universe much like the original marvel universe in comic books was established by crossing over common plots settings casts and characters ;73;51;69.86301369863014
List of M*A*S*H characters;"This is a list of characters from the M*A*S*H franchise, covering the various fictional characters appearing in the novel MASH: A Novel About Three Army Doctors and its sequels, the 1970 film adaptation of the novel, and the television series M*A*S*H, AfterMASH, W*A*L*T*E*R, and Trapper John, M.D.
M*A*S*H is a popular media franchise revolving around the staff of the 4077th Mobile Army Surgical Hospital as they attempt to maintain sanity during the harshness of the Korean War.";Film People;26;481;This list characters M*A*S*H franchise, covering various fictional characters appearing novel MASH: A Novel About Three Army Doctors sequels, 1970 film adaptation novel, television series M*A*S*H, AfterMASH, W*A*L*T*E*R, Trapper John, M.D. M*A*S*H popular media franchise revolving around staff 4077th Mobile Army Surgical Hospital attempt maintain sanity harshness Korean War.;List M*A*S*H characters;"this is a list of characters from the m a s h franchise covering the various fictional characters appearing in the novel mash a novel about three army doctors and its sequels the 1970 film adaptation of the novel and the television series m a s h aftermash w a l t e r and trapper john m d 
m a s h is a popular media franchise revolving around the staff of the 4077th mobile army surgical hospital as they attempt to maintain sanity during the harshness of the korean war ";92;59;64.13043478260869
List of Matrix series characters;This is a list of characters from The Matrix franchise universe. Many of the characters listed here have names reflecting certain aspects of them, such as their status, personality, or role.;Film People;32;190;This list characters The Matrix franchise universe. Many characters listed names reflecting certain aspects them, status, personality, role.;List Matrix series characters;this is a list of characters from the matrix franchise universe many of the characters listed here have names reflecting certain aspects of them such as their status personality or role ;31;27;87.09677419354838
