Name;Description;Group_of_People;Name_length;Description_length;desc_w/o_stopwords;name_w/o_stopwords;desc_plain;desc_token;desc_types;desc_TTR
Lists of Olympic medalists in water polo;"The following articles contain lists of Olympic medalists in water polo:

List of Olympic medalists in water polo (men)
List of Olympic medalists in water polo (women)";Sports People;40;167;The following articles contain lists Olympic medalists water polo: List Olympic medalists water polo (men) List Olympic medalists water polo (women);Lists Olympic medalists water polo;"the following articles contain lists of olympic medalists in water polo 

list of olympic medalists in water polo men 
list of olympic medalists in water polo women ";27;14;51.85185185185185
Lists of one-club men;"List of one-club men may refer to:

List of one-club men in association football
List of one-club men in rugby league
List of Major League Baseball players who spent their entire career with one franchise
List of NBA players who have spent their entire career with one franchise
List of NHL players who spent their entire career with one franchise";Sports People;21;347;List one-club men may refer to: List one-club men association football List one-club men rugby league List Major League Baseball players spent entire career one franchise List NBA players spent entire career one franchise List NHL players spent entire career one franchise;Lists one-club men;"list of one-club men may refer to 

list of one-club men in association football
list of one-club men in rugby league
list of major league baseball players who spent their entire career with one franchise
list of nba players who have spent their entire career with one franchise
list of nhl players who spent their entire career with one franchise";60;26;43.333333333333336
Lists of Philippine Basketball Association imports;This Philippine Basketball Association (PBA) page is used for splitting purposes to prevent this list from becoming too large. The following list articles have been created for easier navigation among all-time PBA imports, or players who are considered as foreigners in the league:;Sports People;50;281;This Philippine Basketball Association (PBA) page used splitting purposes prevent list becoming large. The following list articles created easier navigation among all-time PBA imports, players considered foreigners league:;Lists Philippine Basketball Association imports;this philippine basketball association pba page is used for splitting purposes to prevent this list from becoming too large the following list articles have been created for easier navigation among all-time pba imports or players who are considered as foreigners in the league ;43;38;88.37209302325581
Lists of Philippine Basketball Association players;This Philippine Basketball Association (PBA) page is used for splitting purposes to prevent this list from becoming too large. The following list articles have been created for easier navigation among all-time PBA players:;Sports People;50;222;This Philippine Basketball Association (PBA) page used splitting purposes prevent list becoming large. The following list articles created easier navigation among all-time PBA players:;Lists Philippine Basketball Association players;this philippine basketball association pba page is used for splitting purposes to prevent this list from becoming too large the following list articles have been created for easier navigation among all-time pba players ;33;29;87.87878787878788
List of Pro Bowl players;"The following is a list of players, both past and current, who have been selected to play in the NFL's annual Pro Bowl game, beginning with the 1950 season.
Between 1938 and 1942, an NFL all star team played the league champion in the NFL All-Star Game. Participants in these games are not recognized by the NFL as Pro Bowlers, and they are not included in this list. No games were played between 1943 and 1950.
Between 1961 and 1969, the NFL and AFL played separate all-star games. This list includes players who were selected to play in the American Football League All-Star game during that period.
Players are listed alphabetically, by surname:


== References ==";Sports People;24;667;The following list players, past current, selected play NFL's annual Pro Bowl game, beginning 1950 season. Between 1938 1942, NFL star team played league champion NFL All-Star Game. Participants games recognized NFL Pro Bowlers, included list. No games played 1943 1950. Between 1961 1969, NFL AFL played separate all-star games. This list includes players selected play American Football League All-Star game period. Players listed alphabetically, surname: == References ==;List Pro Bowl players;"the following is a list of players both past and current who have been selected to play in the nfl s annual pro bowl game beginning with the 1950 season 
between 1938 and 1942 an nfl all star team played the league champion in the nfl all-star game participants in these games are not recognized by the nfl as pro bowlers and they are not included in this list no games were played between 1943 and 1950 
between 1961 and 1969 the nfl and afl played separate all-star games this list includes players who were selected to play in the american football league all-star game during that period 
players are listed alphabetically by surname 


== references ==";117;69;58.97435897435898
Lists of professional bodybuilders;"The following articles contain lists of professional bodybuilders:

List of female professional bodybuilders
List of male professional bodybuilders
List of British bodybuilders
List of German bodybuilders";Sports People;34;204;The following articles contain lists professional bodybuilders: List female professional bodybuilders List male professional bodybuilders List British bodybuilders List German bodybuilders;Lists professional bodybuilders;"the following articles contain lists of professional bodybuilders 

list of female professional bodybuilders
list of male professional bodybuilders
list of british bodybuilders
list of german bodybuilders";26;13;50.0
Lists of professional wrestling personnel;This is an incomplete list of professional wrestlers, commentators, managers, road agents, and other workers associated in professional wrestling categorised by the promotion of which the wrestlers are mainly associated:;Sports People;41;220;This incomplete list professional wrestlers, commentators, managers, road agents, workers associated professional wrestling categorised promotion wrestlers mainly associated:;Lists professional wrestling personnel;this is an incomplete list of professional wrestlers commentators managers road agents and other workers associated in professional wrestling categorised by the promotion of which the wrestlers are mainly associated ;30;25;83.33333333333334
List of athletes who came out of retirement;"In most cases, when a professional athlete announces retirement, he or she retires and then never returns to playing professional sports; however, in rare instances there are some athletes who came out of retirement. The following list shows such athletes in addition to any noteworthy achievements that they earned during their playing career after returning from retirement. It includes only professional athletes who announced retirement, were retired for at least one full season or year, and then returned to play their sport in at least one regular season contest. The list does not include players who sat out at least one full season due to injury and then returned to play without having ever officially announced retirement, nor does it include players whose careers were interrupted because of military service or incarceration. It also excludes free agents who were unable to find a team for at least a season and signed with a team at a later point without having ever officially announced retirement.";Sports People;43;1014;"In cases, professional athlete announces retirement, retires never returns playing professional sports; however, rare instances athletes came retirement. The following list shows athletes addition noteworthy achievements earned playing career returning retirement. It includes professional athletes announced retirement, retired least one full season year, returned play sport least one regular season contest. The list include players sat least one full season due injury returned play without ever officially announced retirement, include players whose careers interrupted military service incarceration. It also excludes free agents unable find team least season signed team later point without ever officially announced retirement.";List athletes came retirement;in most cases when a professional athlete announces retirement he or she retires and then never returns to playing professional sports however in rare instances there are some athletes who came out of retirement the following list shows such athletes in addition to any noteworthy achievements that they earned during their playing career after returning from retirement it includes only professional athletes who announced retirement were retired for at least one full season or year and then returned to play their sport in at least one regular season contest the list does not include players who sat out at least one full season due to injury and then returned to play without having ever officially announced retirement nor does it include players whose careers were interrupted because of military service or incarceration it also excludes free agents who were unable to find a team for at least a season and signed with a team at a later point without having ever officially announced retirement ;164;97;59.14634146341463
Lists of rodeo performers;"The following articles contain lists of rodeo performers:

Bull Riding Hall of Fame
List of Calgary Stampede Rodeo Champions
List of Canadian Professional Rodeo Association Champions
List of Professional Rodeo Cowboys Association Champions
List of Professional Bull Riders Champions
List of ProRodeo Hall of Fame inductees
List of Canadian Pro Rodeo Hall of Fame inductees
National Cowgirl Museum and Hall of Fame
PRCA All-Around Champion
Professional Bull Riders: Heroes and Legends";Sports People;25;483;The following articles contain lists rodeo performers: Bull Riding Hall Fame List Calgary Stampede Rodeo Champions List Canadian Professional Rodeo Association Champions List Professional Rodeo Cowboys Association Champions List Professional Bull Riders Champions List ProRodeo Hall Fame inductees List Canadian Pro Rodeo Hall Fame inductees National Cowgirl Museum Hall Fame PRCA All-Around Champion Professional Bull Riders: Heroes Legends;Lists rodeo performers;"the following articles contain lists of rodeo performers 

bull riding hall of fame
list of calgary stampede rodeo champions
list of canadian professional rodeo association champions
list of professional rodeo cowboys association champions
list of professional bull riders champions
list of prorodeo hall of fame inductees
list of canadian pro rodeo hall of fame inductees
national cowgirl museum and hall of fame
prca all-around champion
professional bull riders heroes and legends";71;33;46.478873239436616
Lists of sailors at the Summer Olympics;"Below are listed lists of sailors at the Summer Olympics.

List of sailors at the Summer Olympics (alphabetically)
List of 49er class sailors at the Summer Olympics
List of Star class sailors at the Summer Olympics";Sports People;39;214;Below listed lists sailors Summer Olympics. List sailors Summer Olympics (alphabetically) List 49er class sailors Summer Olympics List Star class sailors Summer Olympics;Lists sailors Summer Olympics;"below are listed lists of sailors at the summer olympics 

list of sailors at the summer olympics alphabetically 
list of 49er class sailors at the summer olympics
list of star class sailors at the summer olympics";36;15;41.66666666666667
Lists of Sri Lankan cricketers;These are lists of Sri Lankan cricketers;Sports People;30;40;These lists Sri Lankan cricketers;Lists Sri Lankan cricketers;these are lists of sri lankan cricketers;7;7;100.0
Lists of sumo wrestlers;"The following articles contain lists of sumo wrestlers:

List of active sumo wrestlers
List of heaviest sumo wrestlers
List of komusubi
List of ōzeki
List of non-Japanese sumo wrestlers
List of past sumo wrestlers
List of sekiwake
List of sumo elders
List of sumo record holders
List of yokozuna";Sports People;23;295;The following articles contain lists sumo wrestlers: List active sumo wrestlers List heaviest sumo wrestlers List komusubi List ōzeki List non-Japanese sumo wrestlers List past sumo wrestlers List sekiwake List sumo elders List sumo record holders List yokozuna;Lists sumo wrestlers;"the following articles contain lists of sumo wrestlers 

list of active sumo wrestlers
list of heaviest sumo wrestlers
list of komusubi
list of ōzeki
list of non-japanese sumo wrestlers
list of past sumo wrestlers
list of sekiwake
list of sumo elders
list of sumo record holders
list of yokozuna";49;20;40.816326530612244
Lists of Swedish Swimming Championships champions;"See:

List of Swedish Swimming Championships champions (men)
List of Swedish Swimming Championships champions (women)";Sports People;49;117;See: List Swedish Swimming Championships champions (men) List Swedish Swimming Championships champions (women);Lists Swedish Swimming Championships champions;"see 

list of swedish swimming championships champions men 
list of swedish swimming championships champions women ";15;9;60.0
List of Western Australia cricketers;"The following articles contain lists of cricketers who have played for the Western Australian cricket team, organised by format:

List of Western Australia first-class cricketers
List of Western Australia List A cricketers
List of Western Australia Twenty20 cricketers";Sports People;36;268;The following articles contain lists cricketers played Western Australian cricket team, organised format: List Western Australia first-class cricketers List Western Australia List A cricketers List Western Australia Twenty20 cricketers;List Western Australia cricketers;"the following articles contain lists of cricketers who have played for the western australian cricket team organised by format 

list of western australia first-class cricketers
list of western australia list a cricketers
list of western australia twenty20 cricketers";38;23;60.526315789473685
Lists of wrestlers;"The following articles contain lists of wrestlers:

List of amateur wrestlers
List of professional wrestlers
List of Pehlwani wrestlers


== See also ==";Sports People;18;152;The following articles contain lists wrestlers: List amateur wrestlers List professional wrestlers List Pehlwani wrestlers == See also ==;Lists wrestlers;"the following articles contain lists of wrestlers 

list of amateur wrestlers
list of professional wrestlers
list of pehlwani wrestlers


== see also ==";23;14;60.86956521739131
